{
  "schemaVersion": "2.0",
  "caseId": "{{CASE_ID}}",
  "caseType": "asylum_application",
  "name": "Asylum Application (Asylantrag)",
  "description": "Asylum application process per German Asylum Act (AsylG) and EU Dublin III Regulation. Includes registration, interview preparation, evidence gathering, and decision processing per BAMF requirements.",
  "applicant": {
    "name": "{{APPLICANT_NAME}}",
    "dateOfBirth": "{{DATE_OF_BIRTH}}",
    "nationality": "{{NATIONALITY}}",
    "currentStatus": "{{STATUS}}"
  },
  "regulations": [
    {
      "id": "Art_16a_GG",
      "title": "Grundgesetz - Asylrecht",
      "summary": "Constitutional right to asylum. Politically persecuted persons enjoy right of asylum in Germany. Does not apply if entry from safe third country (EU member or country covered by international agreement).",
      "url": "https://www.gesetze-im-internet.de/gg/art_16a.html"
    },
    {
      "id": "§3_AsylG",
      "title": "Asylgesetz - Fl\u00fcchtlingseigenschaft",
      "summary": "Defines refugee status per Geneva Convention. Recognition requires well-founded fear of persecution based on race, religion, nationality, political opinion, or membership of particular social group. State unable or unwilling to provide protection.",
      "url": "https://www.gesetze-im-internet.de/asylvfg_1992/__3.html"
    },
    {
      "id": "§4_AsylG",
      "title": "Asylgesetz - Subsidi\u00e4rer Schutz",
      "summary": "Subsidiary protection for persons not qualifying as refugees but facing serious harm in country of origin: death penalty, torture, inhuman treatment, or serious threat to life from armed conflict.",
      "url": "https://www.gesetze-im-internet.de/asylvfg_1992/__4.html"
    },
    {
      "id": "§25_Abs3_AufenthG",
      "title": "Abschiebungsverbot",
      "summary": "National deportation ban when deportation violates European Convention on Human Rights or poses concrete danger to life, liberty, or physical integrity. Applies even if asylum and subsidiary protection denied.",
      "url": "https://www.gesetze-im-internet.de/aufenthg_2004/__25.html"
    },
    {
      "id": "§13_AsylG",
      "title": "Asylgesetz - Persönliche Asylantragstellung",
      "summary": "Asylum application must be made in person at BAMF branch office or arrival center. Written applications not accepted. Applicant must appear for interview and provide personal data.",
      "url": "https://www.gesetze-im-internet.de/asylvfg_1992/__13.html"
    },
    {
      "id": "§25_AsylG",
      "title": "Asylgesetz - Pers\u00f6nliche Anh\u00f6rung",
      "summary": "Personal interview mandatory before decision. Conducted in language applicant understands via interpreter. Interview covers persecution reasons, flight route, identity, and credibility. Applicant has right to legal counsel.",
      "url": "https://www.gesetze-im-internet.de/asylvfg_1992/__25.html"
    },
    {
      "id": "§29_AsylG",
      "title": "Asylgesetz - Dublin-Verfahren",
      "summary": "EU Dublin III Regulation determines responsible member state for asylum application. If another EU country responsible, transfer request made. Applicant has right to information and legal remedy.",
      "url": "https://www.gesetze-im-internet.de/asylvfg_1992/__29.html"
    },
    {
      "id": "§31_AsylG",
      "title": "Asylgesetz - Entscheidung des Bundesamtes",
      "summary": "BAMF decision types: refugee recognition, subsidiary protection, deportation ban, or rejection. Decision in writing with reasoning. Includes legal remedy information and deadline (typically 2 weeks).",
      "url": "https://www.gesetze-im-internet.de/asylvfg_1992/__31.html"
    },
    {
      "id": "§63_AsylG",
      "title": "Asylgesetz - Aufenthaltsgestattung",
      "summary": "Residence permit pending asylum decision (Aufenthaltsgestattung). Authorizes temporary stay during procedure. Initially limited to specific district, may be expanded after 3 months.",
      "url": "https://www.gesetze-im-internet.de/asylvfg_1992/__63.html"
    },
    {
      "id": "AsylbLG",
      "title": "Asylbewerberleistungsgesetz",
      "summary": "Benefits for asylum seekers during application process. Covers basic needs: accommodation, food, hygiene, healthcare. After 18 months, benefits comparable to German social assistance (Sozialhilfe).",
      "url": "https://www.gesetze-im-internet.de/asylblg/"
    },
    {
      "id": "§16a_AufenthG",
      "title": "Aufenthaltserlaubnis nach Anerkennung",
      "summary": "Residence permit after positive asylum decision. Recognized refugees receive 3-year permit (§25 Abs.2), subsidiary protection 1-year renewable (§25 Abs.2). Permanent residence possible after 3-5 years.",
      "url": "https://www.gesetze-im-internet.de/aufenthg_2004/__16a.html"
    }
  ],
  "requiredDocuments": [
    {
      "name": "Reisepass / Identitätsdokumente",
      "documentType": "passport",
      "description": "Valid passport or other identity documents from country of origin",
      "criticality": "critical",
      "acceptedFormats": ["pdf", "jpg", "jpeg", "png"],
      "validationRules": ["identity_verification", "authenticity_check"],
      "notes": "Passport strongly preferred but not mandatory if unavailable. Alternative documents: national ID card, birth certificate, driver's license, military ID. BAMF examines document authenticity. Failure to present without good reason may negatively affect credibility."
    },
    {
      "name": "Geburtsurkunde",
      "documentType": "birth_certificate",
      "description": "Birth certificate from country of origin",
      "criticality": "optional",
      "acceptedFormats": ["pdf", "jpg", "jpeg", "png"],
      "validationRules": ["certified_copy", "certified_translation_if_not_german"],
      "notes": "Helps establish identity and age if passport unavailable. Translation to German required if in foreign language. Certified copies preferred."
    },
    {
      "name": "Heiratsurkunde / Familiendokumente",
      "documentType": "marriage_family_certificates",
      "description": "Marriage certificates and family status documents",
      "criticality": "optional",
      "acceptedFormats": ["pdf", "jpg", "jpeg", "png"],
      "validationRules": ["certified_copy", "certified_translation_if_not_german"],
      "notes": "Required if claiming family reunification later. Establishes family relationships for dependent applications."
    },
    {
      "name": "Bildungsnachweise",
      "documentType": "education_certificates",
      "description": "School certificates, university degrees, vocational training certificates",
      "criticality": "optional",
      "acceptedFormats": ["pdf", "jpg", "jpeg", "png"],
      "validationRules": ["certified_copy"],
      "notes": "Not required for asylum application but helpful for integration and employment later. Consider apostille or recognition procedures for use in Germany."
    },
    {
      "name": "Berufliche Qualifikationsnachweise",
      "documentType": "professional_certificates",
      "description": "Professional licenses, work certificates, employment records",
      "criticality": "optional",
      "acceptedFormats": ["pdf", "jpg", "jpeg", "png"],
      "validationRules": ["authenticated_if_possible"],
      "notes": "Supports integration and employment prospects. Professional recognition (Anerkennung) may be required for regulated professions."
    },
    {
      "name": "Beweismittel für Verfolgung",
      "documentType": "persecution_evidence",
      "description": "Evidence of persecution: arrest warrants, court documents, threat letters, medical reports of injuries",
      "criticality": "critical",
      "acceptedFormats": ["pdf", "jpg", "jpeg", "png"],
      "validationRules": ["authenticity_assessment"],
      "notes": "CRUCIAL for asylum case. Include: arrest warrants, detention records, court summons, police reports, medical certificates documenting torture/injuries, photos of injuries, threat letters, membership documents of persecuted groups. More evidence strengthens case."
    },
    {
      "name": "Medizinische Atteste",
      "documentType": "medical_certificates",
      "description": "Medical documentation of physical or psychological trauma from persecution",
      "criticality": "critical",
      "acceptedFormats": ["pdf"],
      "validationRules": ["issued_by_licensed_doctor", "detailed_findings"],
      "notes": "Essential if claiming persecution through physical violence or torture. German medical examinations preferred. Psychological trauma (PTSD) should be documented by psychologist/psychiatrist. Detailed medical findings strengthen credibility."
    },
    {
      "name": "Mitgliedschaftsnachweise",
      "documentType": "membership_proof",
      "description": "Proof of membership in persecuted groups: political parties, religious communities, minorities, LGBTQ+ organizations",
      "criticality": "optional",
      "acceptedFormats": ["pdf", "jpg", "jpeg", "png"],
      "validationRules": ["authenticity_check"],
      "notes": "Strengthens claim if persecution based on group membership. Include membership cards, certificates, photos from events, witness statements."
    },
    {
      "name": "Zeitungsartikel / Medienberichte",
      "documentType": "media_reports",
      "description": "News articles, media reports about persecution of applicant or similar cases",
      "criticality": "optional",
      "acceptedFormats": ["pdf", "jpg", "jpeg", "png"],
      "validationRules": ["source_verification"],
      "notes": "Country reports, news articles about persecution of similar groups strengthen case. Include source and date. BAMF consults own country reports but applicant evidence supplements."
    },
    {
      "name": "Flugtickets / Reisedokumente",
      "documentType": "travel_documents",
      "description": "Flight tickets, travel itinerary, transit documents",
      "criticality": "optional",
      "acceptedFormats": ["pdf", "jpg", "jpeg", "png"],